{
  "schemaVersion": 1,
  "id": "shadcn-radix-component-contracts-001",
  "status": "approved",
  "designSystemId": "shadcn-radix-bootstrap",
  "sourceBaselineCommit": "6f14d8f9f5b5638ab97db009d7c164a65331dca7",
  "tokenContractId": "shadcn-radix-token-contract-003",
  "familyCount": 42,
  "familyFiles": [
    "contracts/components/families/accordion.json",
    "contracts/components/families/alert.json",
    "contracts/components/families/alert-dialog.json",
    "contracts/components/families/avatar.json",
    "contracts/components/families/badge.json",
    "contracts/components/families/breadcrumb.json",
    "contracts/components/families/button.json",
    "contracts/components/families/card.json",
    "contracts/components/families/chart.json",
    "contracts/components/families/checkbox.json",
    "contracts/components/families/collapsible.json",
    "contracts/components/families/command.json",
    "contracts/components/families/dialog.json",
    "contracts/components/families/drawer.json",
    "contracts/components/families/dropdown-menu.json",
    "contracts/components/families/empty.json",
    "contracts/components/families/field.json",
    "contracts/components/families/icon.json",
    "contracts/components/families/image.json",
    "contracts/components/families/input.json",
    "contracts/components/families/input-group.json",
    "contracts/components/families/label.json",
    "contracts/components/families/link.json",
    "contracts/components/families/pagination.json",
    "contracts/components/families/popover.json",
    "contracts/components/families/progress.json",
    "contracts/components/families/radio-group.json",
    "contracts/components/families/scroll-area.json",
    "contracts/components/families/select.json",
    "contracts/components/families/separator.json",
    "contracts/components/families/sheet.json",
    "contracts/components/families/sidebar.json",
    "contracts/components/families/skeleton.json",
    "contracts/components/families/slider.json",
    "contracts/components/families/spinner.json",
    "contracts/components/families/switch.json",
    "contracts/components/families/table.json",
    "contracts/components/families/tabs.json",
    "contracts/components/families/textarea.json",
    "contracts/components/families/toggle.json",
    "contracts/components/families/toggle-group.json",
    "contracts/components/families/tooltip.json"
  ],
  "interfaceFiles": [
    "contracts/components/interfaces/cmdk.command.empty.json",
    "contracts/components/interfaces/cmdk.command.group.json",
    "contracts/components/interfaces/cmdk.command.input.json",
    "contracts/components/interfaces/cmdk.command.item.json",
    "contracts/components/interfaces/cmdk.command.list.json",
    "contracts/components/interfaces/cmdk.command.root.json",
    "contracts/components/interfaces/cmdk.command.separator.json",
    "contracts/components/interfaces/html.a.json",
    "contracts/components/interfaces/html.button.json",
    "contracts/components/interfaces/html.caption.json",
    "contracts/components/interfaces/html.div.json",
    "contracts/components/interfaces/html.fieldset.json",
    "contracts/components/interfaces/html.form.json",
    "contracts/components/interfaces/html.input.json",
    "contracts/components/interfaces/html.legend.json",
    "contracts/components/interfaces/html.li.json",
    "contracts/components/interfaces/html.main.json",
    "contracts/components/interfaces/html.nav.json",
    "contracts/components/interfaces/html.ol.json",
    "contracts/components/interfaces/html.p.json",
    "contracts/components/interfaces/html.span.json",
    "contracts/components/interfaces/html.svg.json",
    "contracts/components/interfaces/html.table.json",
    "contracts/components/interfaces/html.tbody.json",
    "contracts/components/interfaces/html.td.json",
    "contracts/components/interfaces/html.textarea.json",
    "contracts/components/interfaces/html.tfoot.json",
    "contracts/components/interfaces/html.th.json",
    "contracts/components/interfaces/html.thead.json",
    "contracts/components/interfaces/html.tr.json",
    "contracts/components/interfaces/html.ul.json",
    "contracts/components/interfaces/radix.accordion.content.json",
    "contracts/components/interfaces/radix.accordion.header.json",
    "contracts/components/interfaces/radix.accordion.item.json",
    "contracts/components/interfaces/radix.accordion.root.json",
    "contracts/components/interfaces/radix.accordion.trigger.json",
    "contracts/components/interfaces/radix.alert-dialog.action.json",
    "contracts/components/interfaces/radix.alert-dialog.cancel.json",
    "contracts/components/interfaces/radix.alert-dialog.content.json",
    "contracts/components/interfaces/radix.alert-dialog.description.json",
    "contracts/components/interfaces/radix.alert-dialog.overlay.json",
    "contracts/components/interfaces/radix.alert-dialog.portal.json",
    "contracts/components/interfaces/radix.alert-dialog.root.json",
    "contracts/components/interfaces/radix.alert-dialog.title.json",
    "contracts/components/interfaces/radix.alert-dialog.trigger.json",
    "contracts/components/interfaces/radix.avatar.fallback.json",
    "contracts/components/interfaces/radix.avatar.image.json",
    "contracts/components/interfaces/radix.avatar.root.json",
    "contracts/components/interfaces/radix.checkbox.indicator.json",
    "contracts/components/interfaces/radix.checkbox.root.json",
    "contracts/components/interfaces/radix.collapsible.content.json",
    "contracts/components/interfaces/radix.collapsible.root.json",
    "contracts/components/interfaces/radix.collapsible.trigger.json",
    "contracts/components/interfaces/radix.dialog.close.json",
    "contracts/components/interfaces/radix.dialog.content.json",
    "contracts/components/interfaces/radix.dialog.description.json",
    "contracts/components/interfaces/radix.dialog.overlay.json",
    "contracts/components/interfaces/radix.dialog.portal.json",
    "contracts/components/interfaces/radix.dialog.root.json",
    "contracts/components/interfaces/radix.dialog.title.json",
    "contracts/components/interfaces/radix.dialog.trigger.json",
    "contracts/components/interfaces/radix.dropdown-menu.checkbox-item.json",
    "contracts/components/interfaces/radix.dropdown-menu.content.json",
    "contracts/components/interfaces/radix.dropdown-menu.group.json",
    "contracts/components/interfaces/radix.dropdown-menu.item.json",
    "contracts/components/interfaces/radix.dropdown-menu.label.json",
    "contracts/components/interfaces/radix.dropdown-menu.portal.json",
    "contracts/components/interfaces/radix.dropdown-menu.radio-group.json",
    "contracts/components/interfaces/radix.dropdown-menu.radio-item.json",
    "contracts/components/interfaces/radix.dropdown-menu.root.json",
    "contracts/components/interfaces/radix.dropdown-menu.separator.json",
    "contracts/components/interfaces/radix.dropdown-menu.sub.json",
    "contracts/components/interfaces/radix.dropdown-menu.sub-content.json",
    "contracts/components/interfaces/radix.dropdown-menu.sub-trigger.json",
    "contracts/components/interfaces/radix.dropdown-menu.trigger.json",
    "contracts/components/interfaces/radix.label.root.json",
    "contracts/components/interfaces/radix.popover.anchor.json",
    "contracts/components/interfaces/radix.popover.content.json",
    "contracts/components/interfaces/radix.popover.portal.json",
    "contracts/components/interfaces/radix.popover.root.json",
    "contracts/components/interfaces/radix.popover.trigger.json",
    "contracts/components/interfaces/radix.progress.indicator.json",
    "contracts/components/interfaces/radix.progress.root.json",
    "contracts/components/interfaces/radix.radio-group.indicator.json",
    "contracts/components/interfaces/radix.radio-group.item.json",
    "contracts/components/interfaces/radix.radio-group.root.json",
    "contracts/components/interfaces/radix.scroll-area.corner.json",
    "contracts/components/interfaces/radix.scroll-area.root.json",
    "contracts/components/interfaces/radix.scroll-area.scrollbar.json",
    "contracts/components/interfaces/radix.scroll-area.thumb.json",
    "contracts/components/interfaces/radix.scroll-area.viewport.json",
    "contracts/components/interfaces/radix.select.content.json",
    "contracts/components/interfaces/radix.select.group.json",
    "contracts/components/interfaces/radix.select.item.json",
    "contracts/components/interfaces/radix.select.item-indicator.json",
    "contracts/components/interfaces/radix.select.item-text.json",
    "contracts/components/interfaces/radix.select.label.json",
    "contracts/components/interfaces/radix.select.portal.json",
    "contracts/components/interfaces/radix.select.root.json",
    "contracts/components/interfaces/radix.select.scroll-down-button.json",
    "contracts/components/interfaces/radix.select.scroll-up-button.json",
    "contracts/components/interfaces/radix.select.separator.json",
    "contracts/components/interfaces/radix.select.trigger.json",
    "contracts/components/interfaces/radix.select.value.json",
    "contracts/components/interfaces/radix.select.viewport.json",
    "contracts/components/interfaces/radix.separator.root.json",
    "contracts/components/interfaces/radix.slider.range.json",
    "contracts/components/interfaces/radix.slider.root.json",
    "contracts/components/interfaces/radix.slider.thumb.json",
    "contracts/components/interfaces/radix.slider.track.json",
    "contracts/components/interfaces/radix.switch.root.json",
    "contracts/components/interfaces/radix.switch.thumb.json",
    "contracts/components/interfaces/radix.tabs.content.json",
    "contracts/components/interfaces/radix.tabs.list.json",
    "contracts/components/interfaces/radix.tabs.root.json",
    "contracts/components/interfaces/radix.tabs.trigger.json",
    "contracts/components/interfaces/radix.toggle-group.item.json",